Sheet: Inputs
B1: Ticker Symbol | C1: Years | D1: Period Ending | E1: Total Revenue | F1: Cost of Revenue | G1: Sales, General and Admin. | H1: Other Operating Items | I1: Gross Profit | J1: Operating Income | K1: Gross Margin | L1: Operating Margin
A2: 1 | B2: NAVI | C2: Year 1 | D2: 2013-12-31 | E2: 5015000000 | F2: 1844000000 | G2: 446000000 | H2: 104000000 | I2: of:=[.E2]-[.F2] -> 3171000000 | J2: of:=[.E2]-SUM([.F2:.H2]) -> 2621000000 | K2: of:=1-([.F2]/[.E2]) -> 0.632303090727817 | L2: of:=[.J2]/[.E2] -> 0.522632103688933
A3: 2 | B3: NAVI | C3: Year 2 | D3: 2014-12-31 | E3: 5115000000 | F3: 1945000000 | G3: 495000000 | H3: 122000000 | I3: of:=[.E3]-[.F3] -> 3170000000 | J3: of:=[.E3]-SUM([.F3:.H3]) -> 2553000000 | K3: of:=1-([.F3]/[.E3]) -> 0.619745845552297 | L3: of:=[.J3]/[.E3] -> 0.499120234604106
A4: 3 | B4: NAVI | C4: Year 3 | D4: 2015-12-31 | E4: 4183000000 | F4: 1479000000 | G4: 545000000 | H4: 137000000 | I4: of:=[.E4]-[.F4] -> 2704000000 | J4: of:=[.E4]-SUM([.F4:.H4]) -> 2022000000 | K4: of:=1-([.F4]/[.E4]) -> 0.646426010040641 | L4: of:=[.J4]/[.E4] -> 0.483385130289266
A5: 4 | B5: PYPL | C5: Year 1 | D5: 2014-12-31 | E5: 8025000000 | F5: 747000000 | G5: 5494000000 | H5: 516000000 | I5: of:=[.E5]-[.F5] -> 7278000000 | J5: of:=[.E5]-SUM([.F5:.H5]) -> 1268000000 | K5: of:=1-([.F5]/[.E5]) -> 0.906915887850467 | L5: of:=[.J5]/[.E5] -> 0.158006230529595
A6: 5 | B6: PYPL | C6: Year 2 | D6: 2015-12-31 | E6: 9248000000 | F6: 792000000 | G6: 6339000000 | H6: 608000000 | I6: of:=[.E6]-[.F6] -> 8456000000 | J6: of:=[.E6]-SUM([.F6:.H6]) -> 1509000000 | K6: of:=1-([.F6]/[.E6]) -> 0.914359861591695 | L6: of:=[.J6]/[.E6] -> 0.163170415224914
A7: 6 | B7: PYPL | C7: Year 3 | D7: 2016-12-31 | E7: 10842000000 | F7: 834000000 | G7: 7698000000 | H7: 724000000 | I7: of:=[.E7]-[.F7] -> 10008000000 | J7: of:=[.E7]-SUM([.F7:.H7]) -> 1586000000 | K7: of:=1-([.F7]/[.E7]) -> 0.923076923076923 | L7: of:=[.J7]/[.E7] -> 0.146282973621103
A8: 7 | B8: QRVO | C8: Year 1 | D8: 2014-03-29 | E8: 1148231000 | F8: 940573000 | G8: 180317000 | H8: 0 | I8: of:=[.E8]-[.F8] -> 207658000 | J8: of:=[.E8]-SUM([.F8:.H8]) -> 27341000 | K8: of:=1-([.F8]/[.E8]) -> 0.180850368958859 | L8: of:=[.J8]/[.E8] -> 0.0238114107701325
A9: 8 | B9: QRVO | C9: Year 2 | D9: 2015-03-28 | E9: 1710966000 | F9: 1279152000 | G9: 309348000 | H9: 0 | I9: of:=[.E9]-[.F9] -> 431814000 | J9: of:=[.E9]-SUM([.F9:.H9]) -> 122466000 | K9: of:=1-([.F9]/[.E9]) -> 0.252380234323768 | L9: of:=[.J9]/[.E9] -> 0.0715771090717174
A10: 9 | B10: QRVO | C10: Year 3 | D10: 2016-04-02 | E10: 2610726000 | F10: 2009936000 | G10: 588822000 | H10: 0 | I10: of:=[.E10]-[.F10] -> 600790000 | J10: of:=[.E10]-SUM([.F10:.H10]) -> 11968000 | K10: of:=1-([.F10]/[.E10]) -> 0.230123728035803 | L10: of:=[.J10]/[.E10] -> 0.00458416547734232
A11: 10 | B11: WRK | C11: Year 1 | D11: 2014-09-30 | E11: 9895100000 | F11: 7961500000 | G11: 937600000 | H11: 86000000 | I11: of:=[.E11]-[.F11] -> 1933600000 | J11: of:=[.E11]-SUM([.F11:.H11]) -> 910000000 | K11: of:=1-([.F11]/[.E11]) -> 0.19540984931936 | L11: of:=[.J11]/[.E11] -> 0.0919647098058635
A12: 11 | B12: WRK | C12: Year 2 | D12: 2015-09-30 | E12: 11124800000 | F12: 8986500000 | G12: 1026100000 | H12: 118900000 | I12: of:=[.E12]-[.F12] -> 2138300000 | J12: of:=[.E12]-SUM([.F12:.H12]) -> 993300000 | K12: of:=1-([.F12]/[.E12]) -> 0.19221019703725 | L12: of:=[.J12]/[.E12] -> 0.0892869984179491
A13: 12 | B13: WRK | C13: Year 3 | D13: 2016-09-30 | E13: 14171800000 | F13: 11413200000 | G13: 1750100000 | H13: 211800000 | I13: of:=[.E13]-[.F13] -> 2758600000 | J13: of:=[.E13]-SUM([.F13:.H13]) -> 796700000 | K13: of:=1-([.F13]/[.E13]) -> 0.194654172370482 | L13: of:=[.J13]/[.E13] -> 0.0562172765633159
B16: Company List | D16: Scenarios
B17: NAVI | D17: Strong Case
B18: PYPL | D18: Base Case
B19: QRVO | D19: Weak Case
B20: WRK

Sheet: Financial Forecasting
B2: Ticker
B3: NAVI
B5: Income Statement
E6: Historical | H6: Forecast
E7: Year 1 | F7: Year 2 | G7: Year 3 | H7: Year 4 | I7: Year 5
B8: Revenue | E8: of:=INDEX(revenue;MATCH(1;([.$B$3]=ticker)*([.$E$7]=year);0)) -> 5015000000 | F8: of:=INDEX(revenue;MATCH(1;([.$B$3]=ticker)*([.$F$7]=year);0)) -> 5115000000 | G8: of:=INDEX(revenue;MATCH(1;([.$B$3]=ticker)*([.$G$7]=year);0)) -> 4183000000 | H8: of:=[.G8]*(1+[.H21]) -> 3927274367.2599 | I8: of:=[.H8]*(1+[.I21]) -> 3765727881.73598
B9: COGS | E9: of:=INDEX(cogs;MATCH(1;([.$B$3]=ticker)*([.$E$7]=year);0)) -> 1844000000 | F9: of:=INDEX(cogs;MATCH(1;([.$B$3]=ticker)*([.$F$7]=year);0)) -> 1945000000 | G9: of:=INDEX(cogs;MATCH(1;([.$B$3]=ticker)*([.$G$7]=year);0)) -> 1479000000
B10: Gross Profit | E10: of:=[.E8]-[.E9] -> 3171000000 | F10: of:=[.F8]-[.F9] -> 3170000000 | G10: of:=[.G8]-[.G9] -> 2704000000 | H10: of:=[.H8]*[.H22] -> 2563822818.5354 | I10: of:=[.I8]*[.I22] -> 2533675794.64854
B11: Sales, General and Admin. | E11: of:=INDEX(sgas;MATCH(1;([.$B$3]=ticker)*([.$E$7]=year);0)) -> 446000000 | F11: of:=INDEX(sgas;MATCH(1;([.$B$3]=ticker)*([.$F$7]=year);0)) -> 495000000 | G11: of:=INDEX(sgas;MATCH(1;([.$B$3]=ticker)*([.$G$7]=year);0)) -> 545000000
B12: Other Operating Items | E12: of:=INDEX(other;MATCH(1;([.$B$3]=ticker)*([.$E$7]=year);0)) -> 104000000 | F12: of:=INDEX(other;MATCH(1;([.$B$3]=ticker)*([.$F$7]=year);0)) -> 122000000 | G12: of:=INDEX(other;MATCH(1;([.$B$3]=ticker)*([.$G$7]=year);0)) -> 137000000
B13: Total Operating Expenses | E13: of:=SUM([.E11:.E12]) -> 550000000 | F13: of:=SUM([.F11:.F12]) -> 617000000 | G13: of:=SUM([.G11:.G12]) -> 682000000
B14: Operating Income/EBIT | E14: of:=[.E10]-[.E13] -> 2621000000 | F14: of:=[.F10]-[.F13] -> 2553000000 | G14: of:=[.G10]-[.G13] -> 2022000000 | H14: of:=[.H8]*[.H23] -> 2127453574.54564 | I14: of:=[.I8]*[.I23] -> 1964627268.06335
B16: Scenario
B17: Strong Case
B19: Operaring Statistics
E20: Historical | H20: Assumptions
B21: Revenue Growth (%) | F21: of:=([.$F$8]/[.$E$8])-1 -> 0.0199401794616152 | G21: of:=([.$G$8]/[.$F$8])-1 -> -0.182209188660802 | H21: of:=OFFSET([.$H$29];MATCH([.$B$17];[.$B$30:.$B$32];0);0) -> -0.0611345045995932 | I21: of:=OFFSET([.$H$29];MATCH([.$B$17];[.$B$30:.$B$32];0);1) -> -0.0411345045995932
B22: Gross Margin | E22: of:=INDEX(gross_margin;MATCH(1;([.$B$3]=ticker)*([.$E$7]=year);0)) -> 0.632303090727817 | F22: of:=INDEX(gross_margin;MATCH(1;([.$B$3]=ticker)*([.$F$7]=year);0)) -> 0.619745845552297 | G22: of:=INDEX(gross_margin;MATCH(1;([.$B$3]=ticker)*([.$G$7]=year);0)) -> 0.646426010040641 | H22: of:=OFFSET([.$H$33];MATCH([.$B$17];[.$B$34:.$B$36];0);0) -> 0.652824982106918 | I22: of:=OFFSET([.$I$33];MATCH([.$B$17];[.$B$34:.$B$36];0);0) -> 0.672824982106918
B23: Operating Margin | E23: of:=INDEX(operating_margin;MATCH(1;([.$B$3]=ticker)*([.$E$7]=year);0)) -> 0.522632103688933 | F23: of:=INDEX(operating_margin;MATCH(1;([.$B$3]=ticker)*([.$F$7]=year);0)) -> 0.499120234604106 | G23: of:=INDEX(operating_margin;MATCH(1;([.$B$3]=ticker)*([.$G$7]=year);0)) -> 0.483385130289266 | H23: of:=OFFSET([.$I$37];MATCH([.$B$17];[.$B$38:.$B$40];0);0) -> 0.541712489527435 | I23: of:=OFFSET([.$H$37];MATCH([.$B$17];[.$B$38:.$B$40];0);0) -> 0.521712489527435
B27: Operating Scenarios - Sensetivity Analysis
B29: Revenue Growth (%)
B30: Strong Case | C30: 1 | H30: of:=[.$H$31]+0.02 -> -0.0611345045995932 | I30: of:=[.$H$31]+0.04 -> -0.0411345045995932
B31: Base Case | C31: 2 | H31: of:=AVERAGE([.$F$21:.$G$21]) -> -0.0811345045995932 | I31: of:=AVERAGE([.$F$21:.$G$21]) -> -0.0811345045995932
B32: Weak Case | C32: 3 | H32: of:=[.$H$31]-0.02 -> -0.101134504599593 | I32: of:=[.$H$31]-0.04 -> -0.121134504599593
B33: Gross Margin
B34: Strong Case | C34: 1 | H34: of:=[.$H$35]+0.02 -> 0.652824982106918 | I34: of:=[.$H$35]+0.04 -> 0.672824982106918
B35: Base Case | C35: 2 | H35: of:=AVERAGE([.$E$22:.$G$22]) -> 0.632824982106918 | I35: of:=AVERAGE([.$E$22:.$G$22]) -> 0.632824982106918
B36: Weak Case | C36: 3 | H36: of:=[.$H$35]-0.02 -> 0.612824982106918 | I36: of:=[.$H$35]-0.04 -> 0.592824982106918
B37: Operating Margin
B38: Strong Case | C38: 1 | H38: of:=[.$H$39]+0.02 -> 0.521712489527435 | I38: of:=[.$H$39]+0.04 -> 0.541712489527435
B39: Base Case | C39: 2 | H39: of:=AVERAGE([.$E$23:.$G$23]) -> 0.501712489527435 | I39: of:=AVERAGE([.$E$23:.$G$23]) -> 0.501712489527435
B40: Weak Case | C40: 3 | H40: of:=[.$H$39]-0.02 -> 0.481712489527435 | I40: of:=[.$H$39]-0.04 -> 0.461712489527435

Sheet: Assumptions
B2: Ticker
B3: PYPL
B5: Income Statement
E6: Historical | H6: Forecast
E7: Year 1 | F7: Year 2 | G7: Year 3 | H7: Year 4 | I7: Year 5
B8: Revenue | E8: of:=INDEX(revenue;MATCH(1;([.$B$3]=ticker)*([.$E$7]=year);0)) -> 8025000000 | F8: of:=INDEX(revenue;MATCH(1;([.$B$3]=ticker)*([.$F$7]=year);0)) -> 9248000000 | G8: of:=INDEX(revenue;MATCH(1;([.$B$3]=ticker)*([.$G$7]=year);0)) -> 10842000000 | H8: of:=[.G8]*(1+[.H21]) -> 12522510000 | I8: of:=[.H8]*(1+[.I21]) -> 14463499050
B9: COGS | E9: of:=INDEX(cogs;MATCH(1;([.$B$3]=ticker)*([.$E$7]=year);0)) -> 747000000 | F9: of:=INDEX(cogs;MATCH(1;([.$B$3]=ticker)*([.$F$7]=year);0)) -> 792000000 | G9: of:=INDEX(cogs;MATCH(1;([.$B$3]=ticker)*([.$G$7]=year);0)) -> 834000000
B10: Gross Profit | E10: of:=[.E8]-[.E9] -> 7278000000 | F10: of:=[.F8]-[.F9] -> 8456000000 | G10: of:=[.G8]-[.G9] -> 10008000000 | H10: of:=[.H8]*[.H22] -> 11520709200 | I10: of:=[.I8]*[.I22] -> 13306419126
B11: Sales, General and Admin. | E11: of:=INDEX(sgas;MATCH(1;([.$B$3]=ticker)*([.$E$7]=year);0)) -> 5494000000 | F11: of:=INDEX(sgas;MATCH(1;([.$B$3]=ticker)*([.$F$7]=year);0)) -> 6339000000 | G11: of:=INDEX(sgas;MATCH(1;([.$B$3]=ticker)*([.$G$7]=year);0)) -> 7698000000
B12: Other Operating Items | E12: of:=INDEX(other;MATCH(1;([.$B$3]=ticker)*([.$E$7]=year);0)) -> 516000000 | F12: of:=INDEX(other;MATCH(1;([.$B$3]=ticker)*([.$F$7]=year);0)) -> 608000000 | G12: of:=INDEX(other;MATCH(1;([.$B$3]=ticker)*([.$G$7]=year);0)) -> 724000000
B13: Total Operating Expenses | E13: of:=SUM([.E11:.E12]) -> 6010000000 | F13: of:=SUM([.F11:.F12]) -> 6947000000 | G13: of:=SUM([.G11:.G12]) -> 8422000000
B14: Operating Income/EBIT | E14: of:=[.E10]-[.E13] -> 1268000000 | F14: of:=[.F10]-[.F13] -> 1509000000 | G14: of:=[.G10]-[.G13] -> 1586000000 | H14: of:=[.H8]*[.H23] -> 1878376500 | I14: of:=[.I8]*[.I23] -> 2169524857.5
B16: Scenario
B17: Base Case
B19: Operaring Statistics
E20: Historical | H20: Assumptions
B21: Revenue Growth (%) | F21: of:=([.$F$8]/[.$E$8])-1 -> 0.152398753894081 | G21: of:=([.$G$8]/[.$F$8])-1 -> 0.172361591695502 | H21: of:=OFFSET([.$H$29];MATCH([.$B$17];[.$B$30:.$B$32];0);0) -> 0.155 | I21: of:=OFFSET([.$H$29];MATCH([.$B$17];[.$B$30:.$B$32];0);1) -> 0.155
B22: Gross Margin | E22: of:=INDEX(gross_margin;MATCH(1;([.$B$3]=ticker)*([.$E$7]=year);0)) -> 0.906915887850467 | F22: of:=INDEX(gross_margin;MATCH(1;([.$B$3]=ticker)*([.$F$7]=year);0)) -> 0.914359861591695 | G22: of:=INDEX(gross_margin;MATCH(1;([.$B$3]=ticker)*([.$G$7]=year);0)) -> 0.923076923076923 | H22: of:=OFFSET([.$H$33];MATCH([.$B$17];[.$B$34:.$B$36];0);0) -> 0.92 | I22: of:=OFFSET([.$I$33];MATCH([.$B$17];[.$B$34:.$B$36];0);0) -> 0.92
B23: Operating Margin | E23: of:=INDEX(operating_margin;MATCH(1;([.$B$3]=ticker)*([.$E$7]=year);0)) -> 0.158006230529595 | F23: of:=INDEX(operating_margin;MATCH(1;([.$B$3]=ticker)*([.$F$7]=year);0)) -> 0.163170415224914 | G23: of:=INDEX(operating_margin;MATCH(1;([.$B$3]=ticker)*([.$G$7]=year);0)) -> 0.146282973621103 | H23: of:=OFFSET([.$I$37];MATCH([.$B$17];[.$B$38:.$B$40];0);0) -> 0.15 | I23: of:=OFFSET([.$H$37];MATCH([.$B$17];[.$B$38:.$B$40];0);0) -> 0.15
B27: Operating Scenarios - Sensetivity Analysis
B29: Revenue Growth (%)
B30: Strong Case | C30: 1 | H30: 0.16 | I30: 0.17
B31: Base Case | C31: 2 | H31: 0.155 | I31: 0.155
B32: Weak Case | C32: 3 | H32: 0.14 | I32: 0.14
B33: Gross Margin
B34: Strong Case | C34: 1 | H34: 0.93 | I34: 0.93
B35: Base Case | C35: 2 | H35: 0.92 | I35: 0.92
B36: Weak Case | C36: 3 | H36: 0.9 | I36: 0.9
B37: Operating Margin
B38: Strong Case | C38: 1 | H38: 0.17 | I38: 0.17
B39: Base Case | C39: 2 | H39: 0.15 | I39: 0.15
B40: Weak Case | C40: 3 | H40: 0.14 | I40: 0.14